{
  "bindingId": "00000000-0000-4000-8000-000000000001",
  "generation": 2,
  "configDigest": "aaaaaaaaaaaaaaaaaaaaaaaaaaaaaaaaaaaaaaaaaaaaaaaaaaaaaaaaaaaaaaaa",
  "nativeInstanceRef": "native-instance",
  "nativeScopeRef": "native-scope",
  "idempotencyKey": "00000000-0000-4000-8000-000000000002"
}
